ID,Priorité,Domaine,Problème,Emplacement,Recommandation,Impact,Effort,Risque,Confiance,Type,Statut
"RED-TE-03","P1","red-team","Inversion de priorite : la qualification MDR (seul impact qui peut stopper la distribution) est classee P2, et Agent 09 se contredit (conteste Agent 09)","docs/audit-agents/09-juridique-reglementaire.md (MDR en P2 ; reecriture copy en P1)","Faire de l'avis de qualification MDR (regle 11 / MDCG 2019-11) le P0 reel, gate business. Preparer les reecritures de copy (reversibles) mais NE PAS les deployer avant l'avis ; ne pas amputer 'Precision'/'signal de securite' tant que le juriste n'a pas confirme le sens du faisceau.","critique",">1sem","Suivre l'ordre actuel : soit distribuer sans avoir tranche le point qui peut halter le business, soit sacrifier le marketing par prudence excessive non validee.","élevé","verification-juridique","à faire"
"RED-TE-04","P2","red-team","CTA collant / header persistant : playbook CRO generique qui degrade le hero epure (conteste Agents 02 et 03)","docs/audit-agents/02-cro-conversion.md et 03-ux-ui-accessibilite.md (CTA persistant, sticky header)","Un seul test a la fois, une fois le trafic ct-tracke : barre CTA collante discrete vs controle, decision sur downloads par ct. Pas de deploiement sur intuition. Depend d'abord de la pose des tokens ct (agent 12).","modéré","<1j","Degrader la seule entree visuellement distinctive pour un gain de conversion non demontre.","moyen","experimentation","à faire"
"RED-TE-05","P2","red-team","'Prix 15x OnDrip, tester un a-vie plus bas' repose sur des donnees concurrentes [NV] et une comparaison biaisee (conteste Agent 11 P1)","docs/audit-agents/11-concurrence-marche.md (ecart de prix) ; 01-reconnaissance.md:72 (concurrents [NV])","Verifier d'abord les prix/fonctions concurrents de premiere main. Tester le prix par experimentation storefront reelle (conversion vue->download par palier), pas par intuition d'ancre. Ne pas baisser sur une comparaison non verifiee.","modéré","<1sem","Devaloriser le positionnement premium (le moat revendique) sur des donnees non verifiees.","moyen","experimentation","à faire"
"RED-TE-06","P2","red-team","Construire un arbre SEO pour 'calcul debit perfusion' contredit le positionnement de valeur (conteste Agent 08 P1 vs Agent 11 P2)","docs/audit-agents/08-seo-technique-performance.md (pages-outils) vs 11-concurrence-marche.md (calcul = commodite gratuite)","Valider l'intention mot-cle -> download sur UNE page FR ct-trackee avant de batir un arbre. Etendre seulement si le download attribue est reel.","modéré","<2h","Investir un chantier de contenu pour drainer un trafic a faible conversion et renforcer l'association 'commodite gratuite' que la marque veut fuir.","moyen","experimentation","à faire"
"RED-TE-07","P2","red-team","Dark mode du site : effort >1sem sur une hypothese de bounce nocturne non testee (conteste Agent 03 P2)","docs/audit-agents/03-ux-ui-accessibilite.md (thème sombre du site)","Traiter comme une decision, pas un defaut : exiger un signal (part de visites nocturnes, verbatims terrain) avant d'engager le chantier. Prioriser d'abord les correctifs contraste AA, eux reels et cheap.","faible",">1sem","Engager un chantier lourd multi-langues sur une intuition, en repoussant les correctifs d'accessibilite reellement dus.","moyen","decision-strategique","à faire"
"RED-TE-08","P3","red-team","Notation qui penalise des etats pre-lancement comme des defauts de qualite (conteste la methode d'agregation, ex. Agent 12 a 22)","docs/audit-agents/12-analytics-experimentation.md (score 22) ; 05/08/11 (60-63)","Separer explicitement dans la synthese 'etat pre-lancement (se resout)' de 'defaut a corriger maintenant'. Ne pas moyenner les deux dans un score unique qui donne une lecture faussement alarmiste.","faible","<30min","Piloter sur des scores pessimistes biaises et sur-investir a corriger des etats qui disparaitront seuls au lancement.","moyen","decision-strategique","à faire"
"RED-TE-09","P3","red-team","Trous factuels mineurs a ne pas propager : revalidation binaire et triple-comptage de 'eprouve sur le terrain' (conteste Agents 07 et 04/05/09)","docs/audit-agents/07-app-store-aso.md (revalidation) ; 04,05,09 ('eprouve sur le terrain')","Dedupliquer 'eprouve sur le terrain' en un seul item ; corriger la nuance revalidation binaire vs revue metadonnees pour ne pas surdimensionner le frein au changement de nom.","faible","<30min","Aucun ; corrections redactionnelles et de deduplication.","élevé","correction","à faire"
"PRODUI-01","P0","Produit / Activation / Rétention","Permission notif ni préparée ni rattrapée : échec silencieux du hook entier","dropp-native/DroppKit/Sources/DroppKit/LocalNotificationScheduler.swift:93-98 (ensureAuthorization) ; aucune vue ne teste .denied (grep authorizationStatus/.denied = 1 seule occurrence, ligne 96, sur .notDetermined)","Ajouter (1) un écran/feuille d'amorçage de valeur juste avant la 1re demande ('Dropp vous prévient à la fin de la perfusion — autorisez les notifications') ; (2) une détection permanente de authorizationStatus == .denied avec un bandeau discret persistant renvoyant vers UIApplication.openSettingsURLString. Sans notif autorisée, prévenir que l'alarme ne sonnera pas.","critique","<2h","Faible : ajout d'UI conditionnelle et d'un check d'autorisation, sans toucher au flow existant. Veiller à ne pas re-prompter (une seule demande système possible).","élevé","correction","à faire"
"PRODUI-02","P1","Produit / Activation / Rétention","Aucun prompt d'avis in-app : 0 note, pas de preuve sociale ni de rappel de valeur","dropp-native (grep requestReview/SKStoreReview = 0 occurrence) ; moment idéal non exploité : Dropp/Views/DoneView.swift ; fiche App Store = 0 avis / 0 note (recon 01 §5)","Déclencher requestReview() depuis DoneView après N fins réussies (ex. 3e), avec garde-fou (jamais plus d'1 fois, Apple plafonne à 3/an). Ne jamais le déclencher après un échec ou un remplacement.","important","<2h","Faible. Seul risque : sur-solliciter → respecter le plafond et cibler les fins naturelles réussies uniquement.","élevé","optimisation","à faire"
"PRODUI-03","P1","Produit / Activation / Rétention","Habitude fragile pour le Free : aucune surface de lancement rapide (widget/raccourci/Control Center)","dropp-native (grep WidgetKit/Complication = 0 ; AppIntents de lancement = 0, seul WatchDoubleTap.swift utilise AppIntents pour le geste) ; friction dans Dropp/Views/NewSessionView.swift:149-182","Ajouter un widget (Lock/Home Screen) et un App Shortcut 'Nouvelle perfusion' GRATUITS. Un lancement gratuit à faible friction fait plus pour l'habitude (et donc la conversion ultérieure) qu'une fonction Pro de plus. L'Apple Watch résout la friction mais elle est payante — le Free ne doit pas rester condamné à ressortir le téléphone.","modéré","<1sem","Modéré : nouvelle cible Widget + partage d'état via App Group (déjà en place). Ne pas dupliquer la logique de notif ; réutiliser AppState.","moyen","experimentation","à faire"
"PRODUI-04","P1","Produit / Activation / Rétention","Justification d'abonnement récurrent structurellement faible (risque churn/remboursement annuel)","dropp-native/Dropp/Views/PaywallView.swift:30-38 (features) et 66-92 (plans) ; option à vie ligne 86-92","Assumer que le 'à vie' cannibalise l'abonnement (cohérent avec le pilier 'un seul achat'). Positionner l'abonnement comme rampe d'accès à faible engagement (essai + mensuel), mettre en avant le 'à vie' comme destination, et piloter le modèle sur le taux de renouvellement annuel plutôt que d'en faire le cœur. Ne pas empiler des fonctions Pro décoratives en croyant justifier le récurrent.","modéré","<1j","Faible côté implémentation (copy/hiérarchie du paywall) ; décision stratégique sur le mix de revenus à trancher côté produit.","moyen","decision-strategique","à faire"
"PRODUI-05","P2","Produit / Activation / Rétention","Décalage de langue = rebond de première session pour les non-francophones","Fiche App Store : langues déclarées 'Anglais' (recon 01 §5) ; UI app 100% FR codée en dur, aucune localisation (recon 01 §6 ; dropp-native sans .lproj/String Catalog)","Aligner la langue déclarée sur la réalité (FR) tant que l'app n'est pas localisée, OU accélérer la localisation EN (prévue v1.1). La mécanique fiche relève de l'agent ASO ; l'impact ici est rétention/première session. Ne pas exposer l'app aux stores anglophones avec une UI FR.","important","<30min","Faible (métadonnées). La vraie correction de fond = localisation, effort plus large hors périmètre.","élevé","correction","à faire"
"PRODUI-06","P2","Produit / Activation / Rétention","Fréquence réelle du job-to-be-done non validée = plafond de rétention structurel","Positionnement produit (calcul de débit en gouttes / perfusion par gravité) — brief CLAUDE.md dropp-native ; recon 01 §CONTEXTE","Valider la fréquence réelle d'usage par segment (étudiants infirmiers, IDE libéraux/HAD, urgences, blocs) avant d'investir en fonctions. Cibler en priorité l'acquisition sur les segments à forte fréquence de perfusion par gravité (formation, libéral, HAD), où l'habitude peut se former.","important",">1sem","Faible (recherche, aucun changement de code). Risque de ne pas le faire : plafonner la rétention sans le savoir et sur-investir en fonctions.","faible","decision-strategique","à faire"
"PRODUI-07","P3","Produit / Activation / Rétention","Historique Pro sous-exploité comme renfort d'habitude (dans le respect réglementaire)","dropp-native/DroppKit/Sources/DroppKit/AppState.swift:155-171 (history, plafonné à 10) ; PaywallView.swift:35","Afficher un compteur agrégé discret de perfusions menées à terme (pas d'horodatage patient, pas de journal de constantes — rester hors périmètre MDR). Renforce le sentiment 'ça marche à chaque fois' sans rien monétiser de sensible.","faible","<2h","Faible, mais garder une vigilance réglementaire : aucun horodatage de constantes, aucune donnée patient. Compteur d'événements uniquement.","moyen","optimisation","à faire"
