ID,Priorité,Domaine,Problème,Emplacement,Recommandation,Impact,Effort,Risque,Confiance,Type,Statut
"FICHE-05","P2","Fiche App Store FR & ASO","Sous-titre 'Rythme de perfusion' abstrait et redondant","Sous-titre fiche live 'Rythme de perfusion' (19 car.)","Sous-titre = 'Calcul gouttes/min & tempo' (26 car.) ou 'Gouttes/min, calcul & alarme' (28 car.). Éviter de re-mettre 'perfusion' (déjà dans le nom).","modéré","<30min","Aucun significatif ; tester A/B après indexation.","moyen","optimisation","à faire"
"FICHE-06","P2","Fiche App Store FR & ASO","Nom développeur affiché 'TONY KEVIN DOMINEAUX' (capitales, nom légal)","Fiche live, champ développeur (recon §5)","Renseigner un nom d'affichage propre dans ASC ('Dropp' ou 'Tony Domineaux'). Le nom légal reste privé côté Apple ; l'affiché est éditable et cohérent avec l'entreprise individuelle 'Dropp'.","modéré","<30min","Peut nécessiter validation Apple du nom d'affichage.","élevé","correction","à faire"
"FICHE-07","P2","Fiche App Store FR & ASO","La metadata travaillée (nom/sous-titre/promo) n'est pas déployée sur la fiche live","dropp-native/docs/appstore-metadata.md L10-24 vs fiche live","Déployer la metadata affinée (nom P1, sous-titre P2, description L28-84, champ mots-clés L88) dans ASC ; garder la promo live actuelle plutôt que celle du brouillon.","modéré","<30min","Aucun — synchronisation fiche/repo.","élevé","correction","à faire"
"FICHE-08","P2","Fiche App Store FR & ASO","Champ 'Nouveautés' vide","Fiche live, section Nouveautés absente (recon §5)","Renseigner le texte L93 dès la version publique et le mettre à jour à chaque release.","faible","<30min","Aucun.","élevé","correction","à faire"
"FICHE-09","P3","Fiche App Store FR & ASO","Champ mots-clés : confirmer la saisie et réallouer après changement de nom","Brouillon L88-89 (champ 98/100 car.)","Confirmer la saisie dans ASC ; réallouer les mots doublonnés vers 'ml/h', 'perfuseur', 'hôpital', 'étudiant'. Ne jamais mettre 'dose'/'posologie'.","faible","<30min","Aucun ; garde-fou réglementaire à maintenir.","moyen","optimisation","à faire"
"FICHE-10","P3","Fiche App Store FR & ASO","App non indexée dans la recherche 'Dropp'","Recon §5 [HYP]","Pas d'action directe ; les correctifs P0-P1 accélèrent l'indexation. Suivre la position sur 'débit perfusion', 'gouttes minute', 'calcul perfusion' après 2-3 semaines.","faible","<30min","Aucun.","moyen","experimentation","à faire"
"SEO-01","P1","SEO technique, performance & qualité technique du site dropp.care","title et H1 ne contiennent aucun mot-clé cible (marque/émotion seulement)","locales/fr/home.json meta.title + home.html:535 (H1 = ""Dropp""), buildé dans fr/index.html","Garder l'identité de marque mais injecter le mot-clé en tête/queue de title et enrichir le H1 d'une phrase descriptive. Le wordmark géant peut rester le rendu visuel, le <h1> sémantique portant les mots-clés (garder la classe .hs-title ciblée par le scrollytelling JS).","important","<2h","Faible ; ne pas casser le scrollytelling qui cible .hs-title en JS — changer le texte, garder la classe.","élevé","correction","à faire"
"SEO-02","P1","SEO technique, performance & qualité technique du site dropp.care","Aucune architecture de contenu : mono-page x14 langues, rien ne cible les requêtes informationnelles","src/site.config.json:8-13 (4 pages : home/privacy/support/legal)","Créer un petit arbre de pages-outils + guides, une par intention, chacune : outil interactif réel (réutiliser le moteur de calcul existant) + contexte pédagogique court (formule, tableau facteurs 10/15/20/60) + CTA App Store. Décliner via le pipeline i18n existant.","important","<1sem","Faible : pages neuves isolées ; canonical/hreflang auto-gérés par le build. Commencer par calculateur FR+EN, mesurer, étendre.","moyen","decision-strategique","à faire"
"SEO-03","P2","SEO technique, performance & qualité technique du site dropp.care","FAQ (7 Q) non balisée en FAQPage JSON-LD","home.html:992-998","Générer un bloc FAQPage JSON-LD à partir des clés locale home.faq.q*/a*, injecté dans le <head>, via une fonction analogue au JSON-LD existant (home.html:27-29).","modéré","<2h","Faible (additif).","élevé","optimisation","à faire"
"SEO-04","P2","SEO technique, performance & qualité technique du site dropp.care","Vidéo film tente une lecture auto AVEC son + pas de dimensions (risque CLS)","home.html:922-929 (enter: v.muted=false;v.play()) ; home.html:907 (<video> sans width/height) ; home.html:512 (.film sans aspect-ratio)","Démarrer muet par défaut (ne dé-muter que sur clic du bouton Son déjà câblé) et fixer l'aspect via aspect-ratio ou width/height alignés sur le poster.","modéré","<30min","Faible ; vérifier que sync() reflète l'état muet initial.","élevé","correction","à faire"
"SEO-05","P2","SEO technique, performance & qualité technique du site dropp.care","Titres de section (H2) poétiques, sans valeur de requête","home.html (ex. film.title, watch.title « Tout, sans sortir l'iPhone »), 16 h2/h3 au total","Garder le ton premium mais glisser le vocabulaire métier dans 2-3 H2 clés (démo, gestes, tarifs) sans sur-optimiser.","modéré","<2h","Faible ; conserver la longueur pour text-wrap:balance.","moyen","optimisation","à faire"
"SEO-06","P2","SEO technique, performance & qualité technique du site dropp.care","JSON-LD MobileApplication minimal (offers seul, pas de featureList)","home.html:28","Enrichir avec featureList et lien App Store (installUrl/sameAs). Laisser aggregateRating absent jusqu'à obtention d'avis réels.","faible","<30min","Faible.","moyen","optimisation","à faire"
"SEO-07","P3","SEO technique, performance & qualité technique du site dropp.care","CSS/JS inline dupliqués sur 14 langues, non cachables","home.html (≈84Ko tout inline) ; build.js inlinePartials → chaque /{locale}/index.html embarque le même CSS+JS","À n'envisager QUE si l'analytics futur montre de la navigation inter-langues/multi-pages : extraire dropp.css + dropp.js cachables. Sinon statu quo recommandé.","faible","<1j","Modéré : casse potentielle du timing d'exécution JS / de l'inline sans CSP.","moyen","optimisation","à faire"
"SEO-08","P3","SEO technique, performance & qualité technique du site dropp.care","Détails perf/indexation mineurs (lazy img, OG localisée, VideoObject)","home.html:1002 (appicon sans loading=lazy) ; site.config.json:22-23 (og-image unique) ; film sans VideoObject/sitemap vidéo","Ajouter loading=lazy à l'appicon ; optionnellement OG par langue et VideoObject pour le film.","faible","<30min","Faible.","élevé","optimisation","à faire"
"JURIDI-01","P1","Juridique / RGPD / réglementaire (indicatif — pas un avis juridique)","Nom de l'entrepreneur individuel absent des mentions legales","fr/legal.html:162-166 (blocs Editeur + Directeur de la publication)","Nommer explicitement l'entrepreneur individuel comme editeur ET comme directeur de la publication (LCEN art. 6-III-1 : nom + prenom obligatoires pour un editeur professionnel personne physique). Corrige aussi l'incoherence site (anonyme) / App Store (nom complet).","modéré","<30min","Aucun risque technique ; verifier l'orthographe exacte du nom legal a publier (2e prenom facultatif sur le site).","élevé","correction","à faire"
"JURIDI-02","P1","Juridique / RGPD / réglementaire (indicatif — pas un avis juridique)","Aucune mention du renouvellement automatique de l'abonnement","Section Tarifs, locales/fr/home.json:156-178 (recherche 'renouvellement/tacite/reconduction' = 0 sur tout le site FR)","Ajouter sous les prix une ligne claire sur le renouvellement automatique, la conversion de l'essai et le point de gestion. Obligation attenuee par le role d'Apple (vendeur de fait) mais le site ne doit pas induire en erreur (art. L221-5 C. conso + directive Omnibus). A harmoniser avec l'ecran d'achat in-app (regle Apple 3.1.2).","important","<2h","Formulation a valider par un juriste ; risque de deprimer legerement la conversion (croise l'audit CRO) mais reduit le risque de litige dark pattern.","moyen","correction","à faire"
"JURIDI-03","P1","Juridique / RGPD / réglementaire (indicatif — pas un avis juridique)","« Signal de securite » + « eprouve sur le terrain » alourdissent le risque de qualification dispositif medical","locales/fr/home.json:177 (signal de securite), :211 (eprouve sur le terrain), :10 (Precision), :64 (refuse un tempo absurde)","Neutraliser le vocabulaire de securite/performance sans rien retirer a la fonction : « signal de securite » -> « repere de fin » ; « eprouve sur le terrain » -> « pense pour le terrain ». Conserver 'Precision' et 'refuse un tempo absurde' mais les inscrire sous surveillance (voir finding dedie).","important","<30min","Perte marketing minime ; l'effet reel sur la qualification releve de l'avis reglementaire.","moyen","correction","à faire"
"JURIDI-04","P2","Juridique / RGPD / réglementaire (indicatif — pas un avis juridique)","Qualification MDR (regle 11) non tranchee — avis reglementaire obligatoire","Fonction reelle : home.json:63 (volume/duree -> gtt/min), home.json:110-111 (mode Tap -> mL/h), Agent 1 §4","[AVIS JURISTE / AFFAIRES REGLEMENTAIRES OBLIGATOIRE] Commander une note de qualification MDR (regle 11 + MDCG 2019-11 + position ANSM) a un cabinet specialise. En attendant : verrouiller par ecrit une destination unique 'outil d'aide, non dispositif medical' et la repliquer a l'identique site + App Store + app ; purger le vocabulaire ambigu (findings 2.3 et 2.8).","critique",">1sem","Avis externe couteux/long mais structurant : conditionne le droit de distribuer sans marquage CE dispositif medical avant toute montee en charge ou communication clinique.","élevé","verification-juridique","à faire"
"JURIDI-05","P2","Juridique / RGPD / réglementaire (indicatif — pas un avis juridique)","Aucun lien vers l'EULA / conditions de licence depuis le site","Tout le site FR (recherche 'eula/licence/conditions generales' = 0 occurrence)","Ajouter dans les mentions legales / pied de page un lien vers l'EULA applicable (a minima l'EULA standard Apple) et preciser que l'usage de l'app est regi par cet EULA + les conditions App Store.","modéré","<30min","Aucun ; verifier que le lien Apple standard est bien celui applicable (ou pointer vers un EULA custom si l'app en a un).","moyen","correction","à faire"
"JURIDI-06","P2","Juridique / RGPD / réglementaire (indicatif — pas un avis juridique)","Droit de retractation non mentionne","Tout le site FR (recherche 'retractation' = 0)","Ajouter une ligne dans l'assistance renvoyant a la politique de remboursement Apple, gestionnaire de tous les achats.","faible","<30min","Obligation portee principalement par Apple ; omission peu risquee mais la mention coupe court aux reclamations.","moyen","correction","à faire"
"JURIDI-07","P3","Juridique / RGPD / réglementaire (indicatif — pas un avis juridique)","« Prix de lancement » : allegation promotionnelle a securiser","locales/fr/home.json:167 (« prix de lancement, 7 jours d'essai »)","Soit tenir l'engagement (hausse a date connue), soit retirer « de lancement » et garder le prix nu. Ne pas maintenir une offre de lancement perpetuelle.","faible","<30min","Retirer la mention peut reduire l'incitation a l'urgence (impact CRO marginal).","moyen","optimisation","à faire"
"JURIDI-08","P3","Juridique / RGPD / réglementaire (indicatif — pas un avis juridique)","« Precision » (signature) + « refuse un tempo absurde » a surveiller (cumul MDR)","locales/fr/home.json:10 (Rythme · Precision · Soin), :64 (l'app refuse de battre un tempo absurde)","Les conserver pour l'instant (valeur marketing reelle) mais les inscrire dans la note de destination et les reevaluer selon l'avis MDR. Ne pas ajouter d'autres allegations du meme registre (fiable cliniquement, sur, valide).","faible","<30min","Reecriture prematuree = perte marketing inutile ; attendre l'avis reglementaire.","faible","experimentation","à faire"
"JURIDI-09","P3","Juridique / RGPD / réglementaire (indicatif — pas un avis juridique)","Logs techniques de l'hebergeur (GitHub, USA) non signales","fr/privacy.html (politique de confidentialite) ; hebergeur declare fr/legal.html:169","Ajouter une phrase de prudence indiquant que l'hebergeur peut consigner des donnees techniques de connexion selon sa propre politique, independamment de l'editeur qui ne collecte rien.","faible","<30min","Aucun ; renforce la transparence sans contredire le principe 'zero collecte' de l'editeur.","moyen","correction","à faire"
"CONCUR-01","P1","Concurrence & opportunité de marché","La cadence au poignet n'est pas un différenciant : OnDrip fait déjà exactement ça","Positionnement produit + site dropp.care (sections Hero, 'Trois gestes' Calez, Pro Apple Watch) ; concurrent OnDrip id6483362139","Ne pas fonder la défense concurrentielle sur la fonction tempo (copiable et déjà copiée). Déplacer le discours de moat vers l'exécution premium, la marque, l'auteur-soignant, le français, les perfusions simultanées et l'absence de pub. Éviter toute survente d'innovation qui exposerait à la déception.","important","<2h","Aucun risque produit ; risque marketing de perdre un argument accrocheur si la nuance est mal formulée.","élevé","decision-strategique","à faire"
"CONCUR-02","P1","Concurrence & opportunité de marché","Écart de prix d'un ordre de grandeur avec l'ancre de la catégorie","Tarifs (site + fiche App Store) : 2,99 €/mois, 19,99 €/an, 49,99 € à vie","Justifier explicitement la prime (design, support, français, perfusions simultanées, mises à jour) ou tester un palier à vie plus bas / une offre d'appel. Considérer que l'abonnement est atypique dans une catégorie d'utilities à achat unique et doit être argumenté. À valider par expérimentation d'acquisition réelle.","critique","<1sem","Baisser le prix peut dévaloriser la perception premium ; garder le prix haut peut plafonner la conversion. À trancher par test, pas par intuition.","moyen","experimentation","à faire"
"CONCUR-03","P1","Concurrence & opportunité de marché","Ambition internationale contredite par une app FR-only alors que les concurrents sont multilingues","App native dropp-native (FR codé en dur, cf. recon §6) vs site 14 langues ; concurrent Drip Infusion id358073020","Prioriser la localisation EN de l'app (déjà prévue v1.1) avant tout push international, et aligner les langues déclarées sur la fiche. Le site multilingue draine du trafic qui aboutit à une app inutilisable hors francophonie.","important",">1sem","Localiser une app médicale demande relecture métier par langue ; une traduction approximative sur un outil de santé nuirait à la confiance.","élevé","decision-strategique","à faire"
"CONCUR-04","P2","Concurrence & opportunité de marché","Zéro preuve sociale au lancement dans une catégorie où la confiance prime","Fiche App Store FR id6792277373 : 0 avis / 0 note","Mettre en place une sollicitation d'avis in-app (SKStoreReviewController) déclenchée après un moment de succès (perfusion suivie jusqu'à l'alarme de fin), en ciblant d'abord le marché FR pour concentrer les premières notes localisées.","modéré","<1j","Sur-solliciter irrite ; respecter le rythme Apple (quotas) et ne déclencher qu'après valeur perçue.","élevé","optimisation","à faire"
"CONCUR-05","P2","Concurrence & opportunité de marché","Ne PAS copier les fonctions à risque des concurrents (dose, patients, pub)","Concurrents : CalcuDose / Calculatrice Perfusion Poche (dose+pédiatrie), Drip Infusion (liste patients nommés), Drip Helper (publicité)","Maintenir explicitement le refus de ces trois axes comme décision stratégique documentée. Ce sont des pièges réglementaires et de positionnement, pas des lacunes à combler.","modéré","<30min","Aucun ; formaliser un cap déjà pris. Le vrai risque serait de dévier.","élevé","decision-strategique","à faire"
"CONCUR-06","P2","Concurrence & opportunité de marché","Le calcul seul est gratuit partout : ancrer la valeur payante sur le suivi, pas le calcul","Alternatives gratuites : infdepoche.com, espacesoignant.com, infirmiers.com, walter-learning.com + méthode mentale (microgoutte : gtt/min = mL/h)","S'assurer que le discours du site et de l'ASO n'insiste pas sur 'on calcule le débit' (banal, gratuit ailleurs) mais sur 'on tient le rythme, on suit, on prévient, au poignet' — la partie que seule l'app+Watch délivre.","modéré","<2h","Faible ; ajustement de message.","moyen","optimisation","à faire"
"CONCUR-07","P3","Concurrence & opportunité de marché","Niche premium francophone inoccupée : opportunité réelle mais non validée","Analyse §4 : aucun concurrent tempo n'est premium + francophone + marque soignante","Traiter la francophonie comme tête de pont : concentrer contenu, avis et acquisition sur ce segment où Dropp est structurellement supérieur, puis étendre. Valider par des métriques d'acquisition réelles avant d'investir l'international.","modéré","<1sem","Opportunité perçue à confirmer par le terrain ; ne pas surinvestir avant premiers signaux d'adoption.","faible","experimentation","à faire"
"CONCUR-08","P3","Concurrence & opportunité de marché","Découvrabilité ASO : arbitrer marque vs mots-clés face à des concurrents descriptifs","Fiche App Store : nom 'Dropp', sous-titre 'Rythme de perfusion' vs concurrents 'IV Rate Calc / Drip Rate Calculator and Timer'","Conserver la marque tout en s'assurant que les termes cherchés (débit, perfusion, gouttes/min, calcul, infirmier) figurent dans sous-titre/mots-clés/description. Chevauche l'audit ASO d'un autre agent ; ici c'est cadré côté concurrence (les rivaux captent la recherche générique).","faible","<30min","Faible ; ne pas dénaturer la marque en bourrage de mots-clés.","moyen","optimisation","à faire"
"MESURE-01","P0","Mesure & expérimentation (analytics, funnel, KPI, A/B, tests utilisateurs)","Attribution site vers App Store cassee: CTA en URL nue, sans token de campagne ct","src/site.config.json:4 (appStoreUrl); CTA dans src/templates/home.html:573 (hero), :977 (tarifs), :1005 (badge closing)","Ajouter un token ct distinct par CTA. Aucun cookie, aucun JS, aucune collecte cote site: la promesse 'ne depose aucun cookie et ne collecte aucune donnee' reste litteralement vraie, c'est Apple qui agrege cote store. C'est le levier le plus rentable et le moins couteux pour la promesse.","important","<2h","Quasi nul et reversible. Ne pas confondre ct (campagne, gratuit, aggrege) avec du tracking: aucune donnee utilisateur, aucun consentement requis, aucune MAJ des pages legales necessaire.","élevé","optimisation","à faire"
"MESURE-02","P0","Mesure & expérimentation (analytics, funnel, KPI, A/B, tests utilisateurs)","App Store Connect / App Analytics disponible mais non structure en source de verite","App Store Connect (app id 6792277373); aucun tableau de bord ni funnel dans le repo (docs/)","Formaliser MAINTENANT (pre-lancement) le funnel a 10 etapes et un tableau de bord hebdo 1 page a 4 blocs (Acquisition/Activation-retention/Monetisation/Sante), extrait manuellement ou via l'API App Store Connect. Une ligne = un chiffre + sa tendance vs semaine precedente; si une ligne ne declenche pas de decision, elle sort.","important","<1j","Depend de l'opt-in utilisateur 'Partager avec les developpeurs' (donnees partielles mais non biaisees). Ne pas piloter sur des volumes trop faibles au debut.","moyen","decision-strategique","à faire"
"MESURE-03","P1","Mesure & expérimentation (analytics, funnel, KPI, A/B, tests utilisateurs)","Trancher explicitement la question de l'analytics site (jamais vs cookieless un jour)","locales/fr/privacy.json:3,5,18 et locales/fr/legal.json:14 (engagements publies)","Decision recommandee: rester pur, ZERO analytics site, et s'appuyer entierement sur Apple (ct + App Analytics + Product Page Optimization). N'envisager un analytics cookieless que si le haut de funnel devient un vrai besoin ET apres MAJ assumee des pages legales — jamais en douce. Documenter la decision pour ne pas la reouvrir a chaque tentation.","modéré","<30min","Le vrai risque est de fissurer un actif de confiance pour une mesure a faible valeur immediate. Une fois 'aucune collecte ne changera pas' rompu, la credibilite ne se recupere pas.","moyen","decision-strategique","à faire"
"MESURE-04","P1","Mesure & expérimentation (analytics, funnel, KPI, A/B, tests utilisateurs)","Funnel et distinction metriques essentielles vs vanite jamais formalises","Absence dans docs/ ; concerne l'ensemble du pilotage produit","Adopter la liste: ESSENTIELLES = conversion vue->download, impression->download, downloads par ct, taux d'essai, conversion essai->payant, churn/retention abo M1/M3, retention app J1/J7/J28, crash, desinstallations. VANITE (bannies du pilotage) = downloads cumules, impressions brutes seules, '14 langues' comme trophee, esthetique non mesuree, sessions sans retention.","modéré","<30min","Faible. Le danger inverse est de sur-mesurer et se noyer; garder 4 blocs.","élevé","optimisation","à faire"
"MESURE-05","P1","Mesure & expérimentation (analytics, funnel, KPI, A/B, tests utilisateurs)","Product Page Optimization non utilise et A/B sous-puissants a volume nul","App Store Connect (Product Page Optimization); recon 01-reconnaissance.md:53-54 (0 download, 0 avis, app non indexee)","Preparer un backlog A/B priorise (T1: 1re capture = resultat gtt/min plein ecran; T2: icone signal goutte/cadence; T3: sous-titre 'debit en gouttes/min' vs 'Rythme de perfusion') mais NE lancer qu'apres avoir atteint un volume reel (plusieurs centaines de vues fiche par variante). Priorite = poser la mesure et generer du trafic AVANT de tester.","modéré","<1sem","Conclure sur des echantillons trop petits = pire que ne pas tester. Fixer un seuil minimal de conversions/variante avant de lire.","élevé","experimentation","à faire"
"MESURE-06","P2","Mesure & expérimentation (analytics, funnel, KPI, A/B, tests utilisateurs)","Aucun protocole de test utilisateur avec des soignants","Absence de protocole; concerne la validation compréhension/offre/reglementaire","Lancer un test modere 30-40 min, penser a voix haute, 3-4 infirmiers (perfusions gravitaires) + 2-3 etudiants IFSI, AVANT de scaler l'acquisition. Mesurer: succes de tache, temps, frictions, malentendus (surtout perception 'dispositif medical'), note de recommandation. Regle: probleme vu par >=2/5 = corriger avant de scaler.","modéré","<1sem","Recruter des non-soignants ou des proches = biais de complaisance. Aucune donnee patient; enregistrement seulement avec consentement, supprime apres analyse.","élevé","experimentation","à faire"
"MESURE-07","P2","Mesure & expérimentation (analytics, funnel, KPI, A/B, tests utilisateurs)","Angle mort activation in-app: assumer le proxy retention plutot qu'un SDK","App native (dropp-native); confidentialite home.json:182 'Aucune donnee transmise', privacy.json:5","Assumer explicitement le proxy: retention J1/J7 + sessions par appareil (fournis par App Analytics agrege, sans code) comme signal d'activation. NE PAS ajouter de SDK d'evenements in-app. Le cout promesse (critique) depasse le gain d'un funnel in-app fin a ce stade.","modéré","<30min","La verification juridique est essentielle: un event in-app 'anonyme' reste une collecte au sens de la promesse publiee et de la fiche App Store 'aucune donnee collectee' — a ne pas faire sans revue.","moyen","verification-juridique","à faire"
"MESURE-08","P3","Mesure & expérimentation (analytics, funnel, KPI, A/B, tests utilisateurs)","Piege des metriques de vanite dans le pilotage","Communication produit; recon 01-reconnaissance.md:13-14 ('14 langues'), CTA/hero WebGL","Exclure ces metriques du tableau de bord de pilotage. Juger la couverture linguistique par les downloads/conversions par territoire, pas par le nombre de locales. Juger le hero/film seulement le jour ou il est mesure (conversion), pas a l'esthetique.","faible","<30min","Aucun. Simple discipline de reporting.","élevé","optimisation","à faire"
"RED-TE-01","P1","red-team","'Le hero doit nommer la fonction et le public' est une preference CRO non mesuree, pas un fait critique (conteste Agent 02 P0)","docs/audit-agents/02-cro-conversion.md (P0 hero) ; src/templates/home.html:534-538","Ne pas reecrire le hero a l'aveugle. Trancher par le premier levier mesurable (App Store Product Page Optimization sur la 1re capture) et le test modere 5 utilisateurs de l'agent 12 ('en 20 s, a quoi sert l'app et a qui ?'). Si <2/5 echouent, la 'critique' tombe.","modéré","<1sem","Le vrai risque est de degrader le parti pris premium minimal (force documentee) sur une hypothese non testee, en croyant corriger un defaut.","élevé","decision-strategique","à faire"
"RED-TE-02","P1","red-team","'0 avis' compte 5 fois : un etat de lancement transforme en 5 problemes P1 (conteste Agents 05, 07, 10, 11, 12)","docs/audit-agents/ 05,07,10,11,12 (findings preuve sociale)","Dedupliquer en un seul item d'action : requestReview depuis DoneView apres N fins reussies (plafond Apple). Juger ensuite par App Analytics une fois un volume reel atteint. Ne pas laisser ce theme peser sur 5 domaines.","modéré","<30min","Faible ; risque inverse = faire croire que la preuve sociale est le probleme dominant alors que c'est un sous-produit du non-lancement.","élevé","correction","à faire"
